{
  "bridge_version": "0.1.0",
  "commander_protocol": "zero3-pilot-commander-v1/1.0",
  "github_egress": "healthy",
  "github_ingress": "healthy",
  "last_command_received_at": "2026-08-28T20:26:04Z",
  "last_event_published_at": "2026-08-28T20:26:24Z",
  "outbox_backlog": 0,
  "publish_lag_seconds": 2.203,
  "schema": "zero3.commander.bridge-health/1.0",
  "updated_at": "2026-08-28T20:31:37Z",
  "zero3_central": "unknown",
  "zero3_commander": "healthy"
}
